status,year,country,region,borrowerCode,borrowerType,borrowerNotGouv,financier,financeType,group,reportedValue,reportedUnit,cleanUSD,interestRate,liborRate,repayment,grace,term,purpose
Signed,2019,Zambia,EA,,,Government,AVIC International Project Engineering Company,SC,1.0,24,USD,24,,,,,,"Rehabilitating and maintaining approximately 7,000km of (4,000km – Phase I and 3,000km – Phase II) feeder roads - Phase I"
Implementation,2018,Zambia,EA,2.0,AfrStateCom,Zambia Electricity Supply Corporation Limited (ZESCO) (SOE),China Machinery Engineering Corporation,SC,1.0,15,USD,15,6,,,,,"Lusiwasi Upper Hydropower, 15MW - Bridging Finance"
Implementation,2018,Zambia,EA,2.0,AfrStateCom,Zambia Electricity Supply Corporation Limited (ZESCO) (SOE),China Jiangxi Corporation for International Economic and Technical Cooperation (CJIC),SC,1.0,17,USD,17,10,,1.33,0.0,1.33,"Kabwe - Pensulo Second Transmission Line, 330kV - Bridging Finance"
Signed,2000,Zimbabwe,EA,,,Government,Eximbank,CL,1.0,62,CNY,7,3,,,5.0,15,Unknown (equipment)
Signed,2005,Zimbabwe,EA,,,Government,China National Aero-Technology Import and Export Corporation (CATIC),SC,1.0,12,USD,12,,,,,,MA60 Cargo Plane
Completed,2006,Zimbabwe,EA,,,Government,China National Aero-Technology Import and Export Corporation (CATIC),SC,1.0,150,USD,150,,,,,,Purchase of 12 K-8 Jet Trainer Aircraft
Completed,2006,Zimbabwe,EA,,,Government,Eximbank,EBC,1.0,200,USD,200,,,,,,"Agricultural Equipment, Pesticides, Fertilizer, etc."
Completed,2006,Zimbabwe,EA,,,Government,Eximbank,CL,1.0,200,CNY,26,,,,,,Agricultural Machinery Phase I
Completed,2010,Zimbabwe,EA,2.0,AfrStateCom,NetOne Cellular Private Limited (NetOne) (SOE),Eximbank,CL,1.0,315,CNY,48,,,,5.0,,NetOne Telecom Network Expansion Phase I
Completed,2011,Zimbabwe,EA,,,Government,Eximbank,CL,1.0,675,CNY,107,2,,,7.0,20,National Defense College in Harare
Implementation,2012,Zimbabwe,EA,,,Government,Eximbank,Loan,1.0,144,USD,144,,LIBOR+3,,4.0,9,Harare City Water Reticulation
Completed,2012,Zimbabwe,EA,,,Government,Eximbank,CL,1.0,1025,CNY,164,2,,,,,Victoria Falls Airport Renovation
Completed,2012,Zimbabwe,EA,,,Government,Eximbank,CL,1.0,90,USD,90,2,,,5.0,20,Medical Equipment/Medicine
Completed,2013,Zimbabwe,EA,,,Government,Eximbank,CL,1.0,160,USD,160,,,,,,"Kariba South Bank Hydropower Extension 300MW (CL portion, total 320mn)"
Completed,2014,Zimbabwe,EA,2.0,AfrStateCom,NetOne Cellular Private Limited (NetOne) (SOE),Eximbank,Loan,1.0,1360,CNY,219,2,,,5.0,20,NetOne Telecom Network Expansion Phase II
Signed,2015,Zimbabwe,EA,,,Government,CIDCA,ZIL,1.0,150,CNY,23,0,,,,,Economic and Technical Cooperation Agreement
Completed,2003,Zimbabwe,EA,2.0,AfrStateCom,Zimbabwe Electricity Supply Authority Holding Ltd.- Rural Electrification Agency (ZESA REA) (SOE),China National Aero-Technology Import and Export Corporation (CATIC),SC,1.0,22,USD,22,,,,,,"Transformers, Cables, Switch Gears "
Completed,2004,Zimbabwe,EA,2.0,AfrStateCom,Zimbabwe Electricity Supply Authority Holding Ltd.- Rural Electrification Agency (ZESA REA) (SOE),China National Aero-Technology Import and Export Corporation (CATIC),SC,1.0,40,USD,40,,,,,,Transmission Transformers
Signed,2013,Zimbabwe,EA,,,Government,CIDCA,ZIL,1.0,16,USD,16,0,,,,,"Development in Mining, Water and Other Sectors"
Signed,2013,Zimbabwe,EA,,,Government,CIDCA,ZIL,1.0,60,CNY,10,0,,,,,Road Equipment for Rural District Councils Purchase
Signed,2011,Zimbabwe,EA,,,Government,CIDCA,ZIL,1.0,8,USD,8,0,,,,,Unknown
Signed,2008,Zimbabwe,EA,,,Government,CIDCA,ZIL,1.0,3,USD,3,0,,,,,"Loan for ""Critical Areas that Need Funds"""
Signed,2010,Zimbabwe,EA,,,Government,CIDCA,ZIL,1.0,2,USD,2,0,,,,,"Mahusekwa, Hospital and Supply of Medical Drugs"
Signed,2008,Zimbabwe,EA,2.0,AfrStateCom,Zimbabwe United Passenger Company (ZUPCO) (SOE),Kimberley (Chinese Private Company),SC,1.0,18,USD,18,,,,,,Purchase of 50 Buses
Implementation,2016,Zimbabwe,EA,,,Government,Eximbank,PEBC,1.0,998,USD,998,2,,13.0,7.0,20,Hwange Coal Power Station Expansion 600MW Phase III - Units 7&8
Completed,2015,Zimbabwe,EA,,,Government,Eximbank,CommL,1.0,99,USD,99,5,,,,,TelOne Backbone Optic Fibre Network and the Core and Access Network Modernisation Project
Signed,2017,Zimbabwe,EA,2.0,AfrStateCom,Zimbabwe Mining Development Corporation (ZMDC) (SOE),Xuzhou Construction Machinery Group (XCMG),SC,1.0,5,USD,5,,,,,,Equipment for Artisanal Miners Disbursement 1
Signed,2018,Zimbabwe,EA,2.0,AfrStateCom,Zimbabwe Mining Development Corporation (ZMDC) (SOE),Xuzhou Construction Machinery Group (XCMG),SC,1.0,5,USD,5,,,,,,Equipment for Artisanal Miners Disbursement 2
Signed,2019,Zimbabwe,EA,,,Government,Eximbank,CL,1.0,71,USD,71,2,,15.0,5.0,20,NetOne Telecom Network Expansion Phase III
Completed,2013,Zimbabwe,EA,,,Government,Eximbank,PEBC,1.0,160,USD,160,,,,,,"Kariba South Bank Hydropower Extension 2x150MW(300MW) (PEBC portion, total 320mn)"
Implementation,2018,Zimbabwe,EA,,,Government,Eximbank,CL,1.0,1045,CNY,152,2,,,7.0,20,Harare Robert Gabriel Mugabe International Airport Upgrade
Signed,2015,Zimbabwe,EA,,,Government,CIDCA,ZIL,1.0,33,CNY,5,,,,,,"Supercomputer Center, University of Zimbabwe"
Signed,2002,Algeria,NA,,,Government,CIDCA,ZIL,1.0,3,USD,3,0,,,,,Economic Cooperation Loan
Signed,2002,Algeria,NA,,,Government,CIDCA,ZIL,1.0,6,USD,6,0,,,,25,Economic and Technical Agreement
Signed,2002,Egypt,NA,,,Government,CIDCA,ZIL,1.0,100,CNY,12,0,,,,,Unknown
Completed,2004,Egypt,NA,,,Government,CIDCA,ZIL,1.0,250,CNY,30,0,,,,,Unknown
Signed,2005,Egypt,NA,,,Government,Eximbank,CL,1.0,16,USD,16,2,,20.0,5.0,,Refurbishing of a Polyester Factory owned by Egypt Cotton Holdings Company
Completed,2006,Egypt,NA,,,Government,Eximbank,CL,1.0,476,CNY,61,2,,,,,Cairo International Convention Center
Completed,2012,Egypt,NA,3.0,AfrStateBanks,National Bank of Egypt (NBE) (SOE),CDB,CommL,1.0,200,USD,200,,Libor+3.75,,3.0,8,SMEs
Completed,2015,Egypt,NA,3.0,AfrStateBanks,National Bank of Egypt (NBE) (SOE),CDB,CL,1.0,100,USD,100,,,,,,SMEs
Signed,2002,Egypt,NA,,,Government,CIDCA,ZIL,1.0,100,CNY,12,0,,,,,Unknown
Completed,2016,Egypt,NA,3.0,AfrStateBanks,Central Bank of Egypt (CBE) (SOE),CDB,CommL,1.0,900,USD,900,,,8.0,3.0,11,Bolster foreign exchange reserves
Completed,2016,Egypt,NA,3.0,AfrStateBanks,National Bank of Egypt (NBE) (SOE),CDB,CommL,1.0,700,USD,700,,,8.0,3.0,11,Interbank Loan
Completed,2016,Egypt,NA,3.0,AfrStateBanks,Banque Misr (SOE),CDB,CommL,1.0,100,USD,100,,,3.0,2.0,5,SMEs
Implementation,2019,Egypt,NA,,,Government,Eximbank,Loan,1.0,739,USD,739,1.8,,,,,"Cairo-10th of Ramadan-New Administrative Capital Light Rail, 68km (First Loan, total $1.2 billion)"
Completed,2017,Egypt,NA,2.0,AfrStateCom,Egyptian Electricity Transmission Company (EETC) (SOE),"MixedCN: China Eximbank, CDB and ICBC",Loan,1.0,690,USD,690,,,,,,500kV Transmission Line Project 1210km
Completed,2017,Egypt,NA,3.0,AfrStateBanks,Banque Misr (SOE),CDB,Loan,1.0,500,USD,500,,,,,8,Interbank Loan
Implementation,2018,Egypt,NA,6.0,JV,"Telecom Egypt Company S.A.E. (Egypt 80%, Free Float 20%)","Huawei Technologies Co., Ltd.",SC,1.0,200,USD,200,,,,,,Rollout of 4G network and transmission system
Implementation,2018,Egypt,NA,3.0,AfrStateBanks,National Bank of Egypt (NBE) (SOE),CDB,Loan,1.0,600,USD,600,,,,,,Interbank Loan
Implementation,2019,Egypt,NA,,,Government,Eximbank,Loan,1.0,461,USD,461,2,,10.0,5.0,15,"Cairo-10th of Ramadan-New Administrative Capital Light Rail, 68km (Second Loan, total $1.2 billion)"
Signed,2002,Morocco,NA,,,Government,Eximbank,CL,1.0,50,CNY,6,,,,,,"Ifrane, Chefchaouen and Al-Hoceima irrigation dam projects, Eximbank tranche, total 6 million "
Signed,2002,Morocco,NA,,,Government,CIDCA,ZIL,1.0,5,CNY,1,0,,,,,Geo-chemical map of Goulmim-Asmara
Signed,2001,Morocco,NA,,,Government,Eximbank,Loan,1.0,13,USD,13,,,,,,6 Health Clinics
Completed,2014,Morocco,NA,,,Government,Eximbank,CL,1.0,305,USD,305,,,,,,"Jerada Coal Power Plant (1X350MW=350MW), Eximbank loan, 305 million"
Completed,2011,Morocco,NA,,,Government,Eximbank,CL,1.0,248,USD,248,,,,,,"Berrechid–Ben Ahmed Highway project (Section 1 of Berrechid–Beni Mellal), 38.6km"
Signed,2000,Morocco,NA,,,Government,CIDCA,ZIL,1.0,3,USD,3,0,,,,,Unknown
Signed,2003,Morocco,NA,,,Government,CIDCA,ZIL,1.0,5,USD,5,0,,,,,Unknown
Completed,2018,Morocco,NA,,,Government,ICBC,CommL,1.0,150,USD,150,,,,,,Noor Ouarzazate Solar Power Plant Phase II 200MW
Signed,2008,Morocco,NA,,,Government,Eximbank,EBC,1.0,515,USD,515,,,,,,Equipment purchase
Completed,2001,Sudan,NA,2.0,AfrStateCom,Sudan National Electricity Corporation (NEC) (SOE),"Harbin Electric Company, Ltd.",SC,1.0,128,USD,128,,,,,,El-Jaili (Garri/Qarre) Gas Power Station Phase I 212MW
Completed,2002,Sudan,NA,,,Government,Eximbank,Loan,1.0,39,USD,39,5,,,,4,Khartoum State Electricity - equipment and spare parts
Signed,2003,Sudan,NA,,,Government,Eximbank,Loan,1.0,12,USD,12,3,,,5.0,15,Khartoum State Electricity
Completed,2003,Sudan,NA,,,Government,Eximbank,EBC,1.0,608,USD,608,,,,,,"Merowe Hydropower Project 1,250MW"
Completed,2003,Sudan,NA,,,Government,CN Gov,Loan,1.0,41,USD,41,,,,,,Aircraft Parts
Completed,2003,Sudan,NA,,,Government,CN Gov,Loan,1.0,106,USD,106,,,,,,Military Equipment
Signed,2003,Sudan,NA,,,Government,CN Gov,Loan,1.0,10,USD,10,3.5,,,,4,Water equipment from Bushan Company
Signed,2003,Sudan,NA,,,Government,Eximbank,CL,1.0,4,USD,4,,,,,,International Conference Hall
Signed,2004,Sudan,NA,,,Government,CN Gov,Loan,1.0,11,USD,11,3,,,,1.5,Water equipments
Implementation,2005,Sudan,NA,,,Government,Eximbank,Loan,1.0,33,USD,33,4,,6.0,2.0,8,El-Fashir Water Supply System Project
Signed,2005,Sudan,NA,,,Government,China Machinery Engineering Corporation (CMEC),SC,1.0,22,USD,22,4,,,2.0,6,Grain Depot
Signed,2005,Sudan,NA,,,Government,Eximbank,Loan,1.0,13,USD,13,4,,6.0,2.0,8,Engineering Equipment (Camco Co.)
Signed,2005,Sudan,NA,,,Government,Eximbank,Loan,1.0,11,USD,11,4,,6.0,2.0,8,Drilling of 150 wells (Tanjin Co.)
Signed,2005,Sudan,NA,,,Government,Eximbank,Loan,1.0,10,USD,10,4,,5.0,1.5,6.5,Irrigation Equipment
Signed,2005,Sudan,NA,,,Government,Eximbank,Loan,1.0,7,USD,7,4,,6.0,2.0,8,Rehabilitation of Cotton Ginning Factories
Signed,2005,Sudan,NA,,,Government,Eximbank,Loan,1.0,6,USD,6,3,,5.0,2.0,7,Electric generators (CNEEN Co.)
Signed,2005,Sudan,NA,,,Government,Eximbank,Loan,1.0,4,USD,4,4,,8.0,1.0,9,Drilling of 50 wells in Northern Kordofan (Tianjin Co.)
Signed,2005,Sudan,NA,,,Government,CN Gov,Loan,1.0,4,USD,4,,,,,10,Unknown
Implementation,2006,Sudan,NA,,,Government,China Machinery Engineering Corporation (CMEC),SC,1.0,81,USD,81,,,,,,Rabak-Obied Transmission Line 340km
Completed,2006,Sudan,NA,,,Government,Eximbank,Loan,1.0,34,USD,34,4,,,3.0,7,Dongla Water Supply Project
Completed,2006,Sudan,NA,,,Government,Eximbank,Loan,1.0,27,USD,27,4,,,3.0,7,Matama-Abu Hamed-El Daba Water Supply Project
Completed,2006,Sudan,NA,,,Government,Eximbank,Loan,1.0,29,USD,29,4,,,3.0,7,Wad Medani Water Treatment Plant
Completed,2006,Sudan,NA,,,Government,Eximbank,Loan,1.0,30,USD,30,4,,,3.0,7,Kosti Water Project
Signed,2006,Sudan,NA,,,Government,Eximbank,Loan,1.0,17,USD,17,4,,,2.0,2,Supply of Hdpe Pipes
Signed,2006,Sudan,NA,,,Government,Eximbank,Loan,1.0,5,USD,5,3.4,,,1.0,7,Solar Energy Project in Northern Kordofan (phase I?)
Signed,2007,Sudan,NA,,,Government,CN Gov,,1.0,7,USD,7,5,,,,3.5,Solar Energy Project in Northern Kordofan (phase II?)
Completed,2008,Sudan,NA,,,Government,Eximbank,Loan,1.0,51,USD,51,,,,,,"Nyala Water Supply - water pipes, water spare parts, water tanks, and unspecified project costs"
Signed,2004,Sudan,NA,,,Government,Eximbank,Loan,1.0,4,USD,4,,,,,10,Unknown
Implementation,2005,Sudan,NA,,,Government,Eximbank,Loan,1.0,67,USD,67,4,,6.0,2.0,8,Gedarif Water Supply System Project
Completed,2008,Sudan,NA,,,Government,China International Water & Electric Corporation (CWE),SC,1.0,81,USD,81,,,,,,Kehaila East Agricultural Scheme - Merowe Resettlement
Implementation,2009,Sudan,NA,,,Government,China National Machinery Industry Corporation (Sinomach),SC,1.0,463,USD,463,4,,,4.0,10,Port Sudan Water Project
Signed,2010,Sudan,NA,,,Government,CN Gov,Loan,1.0,10,USD,10,2,,,,15,IT system for education and administration
Signed,2011,Sudan,NA,,,Government,CIDCA,ZIL,1.0,5,USD,5,0,,,,,Economic-Technical Projects / Atbara steel bridge
Completed,2012,Sudan,NA,,,Government,CIDCA,ZIL,1.0,180,CNY,29,0,,,,,Economic and Technical Cooperation Projects / Renovation of Friendship Hall in Khartom
Completed,2011,Sudan,NA,,,Government,CN Gov,Loan,1.0,104,USD,104,,,,,,Upper Atbara Hydropower Project - 135 MW
Completed,2004,Sudan,NA,2.0,AfrStateCom,Sudan National Electricity Corporation (NEC) (SOE),"Harbin Electric Company, Ltd.",SC,1.0,82,USD,82,,,,,,El Jaili (Garri) Power Plant Phase II
Completed,2004,Sudan,NA,2.0,AfrStateCom,Sudan National Electricity Corporation (NEC) (SOE),China Machinery Engineering Corporation (CMEC),SC,1.0,129,USD,129,,,,,,El Jaili (Garri) Power Plant Phase IV 100MW
Implementation,2003,Sudan,NA,2.0,AfrStateCom,Sudan National Electricity Corporation (NEC) (SOE),"Tebian Electric Apparatus Co., Ltd. (TBEA)",SC,1.0,25,USD,25,6,,,,,El Gaili-Shendi-Atbara 220kV transmission line
Completed,2008,Sudan,NA,2.0,AfrStateCom,Sudan National Electricity Corporation (NEC) (SOE),"Tebian Electric Apparatus Co., Ltd. (TBEA)",SC,1.0,29,EUR,41,5,,,,,North Khartoum Electrical Substation and Other Substations/Transmission Lines
Completed,2005,Sudan,NA,2.0,AfrStateCom,Sudan National Electricity Corporation (NEC) (SOE),Eximbank,Loan,1.0,175,USD,175,3.7,,,3.0,9,North Khartoum Power Station/Martyr Dr. Mahmoud Sharif Bbhari phase III/Unit D power plant expansion
Signed,2006,Sudan,NA,2.0,AfrStateCom,Sudan National Electricity Corporation (NEC) (SOE),"China National Electric Engineering Co., Ltd. (CNEEC)",SC,1.0,8,USD,8,,,,,,SP-2 Diesel Generator Power Plant
Signed,2005,Sudan,NA,,,Government,CIDCA,ZIL,1.0,30,CNY,4,0,,,,,Mini diesel power generators
Completed,2009,Sudan,NA,,,Government,China Machinery Engineering Corporation (CMEC),SC,1.0,215,USD,215,,,,,,White Nile Electrification Project (AI-Duwaim/Ad Douiem Electricity Transmission Project)
Completed,2003,Sudan,NA,,,Government,Eximbank,Loan,1.0,381,USD,381,,,,,,Merowe Hydropower Project transmission lines and substations
Completed,2003,Sudan,NA,,,Government,CN Gov,Loan,1.0,38,USD,38,,,,,,New Amri Agricultural Scheme - Merowe Resettlement
Completed,2003,Sudan,NA,,,Government,CN Gov,Loan,1.0,35,USD,35,,,,,,El Mekabrab Agricultural Scheme - Merowe Resettlement
Signed,2004,Sudan,NA,,,Government,CN Gov,Loan,1.0,12,USD,12,,,,,,Rufaa Bridge/Sennar Bridge
Signed,2004,Sudan,NA,,,Government,CN Gov,Loan,1.0,9,USD,9,,,,,,El Dueim Bridge
Signed,2009,Sudan,NA,,,Government,CIDCA,ZIL,1.0,80,CNY,12,,,,,,Unknown
Signed,2008,Sudan,NA,,,Government,CIDCA,ZIL,1.0,100,CNY,15,0,,,,,Presidential Palace
Signed,2002,Sudan,NA,,,Government,CIDCA,ZIL,1.0,30,CNY,4,0,,,,,Unknown
Signed,2004,Sudan,NA,,,Government,CN Gov,Loan,1.0,60,CNY,7,,,,,,Unknown
Implementation,2009,Sudan,NA,,,Government,Eximbank,FA-sub,1.0,199,USD,199,3.5,,,,20,Al Rank-Malakal Road (Peace Road) 340 km
Completed,2009,Sudan,NA,,,Government,Eximbank,FA-sub,1.0,86,USD,86,3.5,,,,20,Aum Kadada-Alfashir Road (or Western Salvation Road/Aum-Fa Road) 168 km
Implementation,2009,Sudan,NA,,,Government,Eximbank,FA-sub,1.0,63,USD,63,3.5,,,,20,South Kordofan Um Rawaba- Abu Gibeha Ring Road / 141 km / Aum Roaba - Abu Gebaha Road
Implementation,2009,Sudan,NA,,,Government,Eximbank,FA-sub,1.0,680,USD,612,,,,,,Al Fulah Gas-Power Plant 300 MW
Implementation,2009,Sudan,NA,,,Government,Eximbank,FA-sub,1.0,90,USD,90,,,,,,Al Dibabat-Abou Zayd-El Fula Road (or Dubeibat-Abu Zabad-El Fula Road) 185 km
Completed,2009,Sudan,NA,,,Government,Eximbank,FA-sub,1.0,110,USD,110,,,,,,El Nahood-Aum Kadada Road (or En Nahud-Um Kadada Road) 211 km
Implementation,2009,Sudan,NA,,,Government,Eximbank,FA-sub,1.0,120,USD,120,,,,,,Zalingei-El Geneinah Road (or Zalingei-Al Junaynah Road) 175 km
Implementation,2010,Sudan,NA,,,Government,Eximbank,FA-sub,1.0,233,USD,233,3,,,,15,South Kordofan Transmission Lines (Al Fulah Thermal Plant's Tranmission Line?)
Signed,2010,Sudan,NA,,,Government,Eximbank,FA-sub,1.0,24,USD,24,5.6,,,,15,Dali water project
Completed,2010,Sudan,NA,,,Government,Eximbank,FA-sub,1.0,59,USD,59,,,,,,"Sennar Bridge 3,025 meters"
Completed,2010,Sudan,NA,,,Government,Eximbank,FA-sub,1.0,30,USD,30,5.6,,,,15,Agricultural improvement/electricification in Blue Nile
Signed,2001,Sudan,NA,,,Government,CIDCA,ZIL,1.0,4,USD,4,0,,,,,Unknown
Signed,2017,Sudan,NA,,,Government,CIDCA,ZIL,1.0,100,CNY,15,,,,,,Rescue boats and civil defense technical equipment
Signed,2018,Sudan,NA,,AfrGov,Government,CIDCA,ZIL,1.0,200,CNY,29,0,,,,,Zero-interest loan from 2018 FOCAC package
Signed,2017,Sudan,NA,,,Government,CIDCA,ZIL,1.0,100,CNY,15,,,,,,Integrated slaughterhouse
Signed,2004,Tunisia,NA,,,Government,Eximbank,CL,1.0,140,CNY,17,,,,,,Tunisie Telecom Project - network switches
Signed,2006,Tunisia,NA,,,Government,Eximbank,CL,1.0,50,CNY,6,,,,,,Tunisie Telecom Project - mobile network
Signed,2000,Tunisia,NA,,,Government,CIDCA,ZIL,1.0,4,TND,3,0,,,,,Unknown
Signed,2006,Tunisia,NA,,,Government,Eximbank,CL,1.0,50,CNY,6,,,,,,Equipment procurement and engineering services to National Telecommunications Corporation of Tunisia
Completed,2009,Tunisia,NA,2.0,AfrStateCom,Tunisian National Railways Company (SNCFT) (SOE),Eximbank,Loan,1.0,80,USD,80,,,,,,Purchase of 20 trains
Signed,2004,Tunisia,NA,,,Government,Eximbank,Loan,1.0,134,CNY,16,,,,,,Telecom project
Signed,2007,Tunisia,NA,,,Government,Eximbank,Loan,1.0,21,CNY,3,,,,,,Telecom project
Completed,2009,Regional,RG,3.0,AfrStateBanks,African Export Import Bank (Afreximbank),Eximbank,Loan,1.0,100,USD,100,,,,,,Trade and Project Finance
Completed,2008,Regional,RG,3.0,AfrStateBanks,Trade and Development Bank (TDB),CDB,Loan,1.0,50,USD,50,,,,,10,"Telecommunication, Mining, Infrastructure and Other Key Sectors"
Completed,2014,Regional,RG,3.0,AfrStateBanks,Trade and Development Bank (TDB),CDB,Loan,1.0,60,USD,60,,,,,,SMEs
Completed,2013,Regional,RG,3.0,AfrStateBanks,Development Bank of Central African States (BDEAC),CDB,Loan,1.0,30,EUR,41,,,,,,SMEs
Completed,2011,Regional,RG,3.0,AfrStateBanks,Banque Ouest Africaine de Developpement (BOAD),CDB,Loan,1.0,60,EUR,78,,,,,,Commercial Sector Projects Refinancing
Completed,2014,Regional,RG,3.0,AfrStateBanks,Banque Ouest Africaine de Developpement (BOAD),CDB,Loan,1.0,125,USD,125,,,,,,Private Sector Lending UEMOA Member States
Implementation,2016,Regional,RG,3.0,AfrStateBanks,African Export Import Bank (Afreximbank),Eximbank,Loan,1.0,50,USD,50,,,,,5,"Trade Finance, China Guaranteed Loan Tranche II"
Implementation,2016,Regional,RG,3.0,AfrStateBanks,Development Bank of Central African States (BDEAC),CDB,Loan,1.0,40,EUR,42,,,,,,SMEs
Implementation,2006,Regional,RG,3.0,AfrStateBanks,Banque Ouest Africaine de Developpement (BOAD),Eximbank,Loan,1.0,70,EUR,92,,,,,,"Financing for Economic Cooperation, Investment, and Business Cooperation with China"
Implementation,2015,Regional,RG,3.0,AfrStateBanks,Banque Ouest Africaine de Developpement (BOAD),CDB,Loan,1.0,100,EUR,109,,,,,,Private Sector Activities in the UEMOA Member States
Implementation,2015,Regional,RG,3.0,AfrStateBanks,Trade and Development Bank (TDB),PBC,Loan,1.0,8,USD,8,,,,,,Unknown
Implementation,2015,Regional,RG,3.0,AfrStateBanks,Trade and Development Bank (TDB),PBC,Loan,1.0,5,USD,5,,,,,,Unknown
Implementation,2017,Regional,RG,3.0,AfrStateBanks,Trade and Development Bank (TDB),Eximbank,EBC,1.0,250,USD,250,,,,,,"Trade, Project and Infrastructure Finance, Treasury "
Implementation,2018,Regional,RG,3.0,AfrStateBanks,African Export Import Bank (Afreximbank),CDB,Loan,1.0,500,USD,500,,,,,10,Medium to Long Term Financing for Sub- Projects in Various Sector
Implementation,2018,Regional,RG,3.0,AfrStateBanks,Africa Finance Corporation (AFC),Eximbank,Loan,1.0,200,USD,200,,,,,5,General Corporate Purposes
Implementation,2018,Regional,RG,3.0,AfrStateBanks,Africa Finance Corporation (AFC),Eximbank,Loan,1.0,100,USD,100,,,,,5,General Corporate Purposes
Signed,2019,Regional,RG,3.0,AfrStateBanks,African Export Import Bank (Afreximbank),Eximbank,Loan,1.0,75,USD,75,,,,,5,"Reduce Cost of Funds and Diversify Books, Investor Type and Tenor, China Guaranteed Loan 2 Tranche II"
Signed,2018,Regional,RG,3.0,AfrStateBanks,African Export Import Bank (Afreximbank),BoC,CommL,1.0,350,USD,350,,,,,,"Loans to African Banks for Trade Finance, Syndicated Loans, Etc."
Completed,2001,Botswana,SA,,,Government,CIDCA,ZIL,1.0,80,CNY,10,0,,,,,Gaborone Multipurpose Youth Center
Signed,2003,Botswana,SA,,,Government,Eximbank,CL,1.0,32,CNY,4,4,,8.0,4.0,12,"Botswana Housing Corporation (BHC) 725 housing in Gaborone, Maun, Jwaneng, Lobatse and Francistown (CL part)"
Completed,2006,Botswana,SA,,,Government,Eximbank,CL,1.0,50,BWP,8,,,,,,Gaborone 293 Houses in District 7
Completed,2003,Botswana,SA,,,Government,Eximbank,CL,1.0,200,CNY,24,3,,7.0,5.0,12,Letlhakeng-Kang Road Section I 561 km (Letlhakeng-Dutlwe)
Completed,2005,Botswana,SA,,,Government,Eximbank,CL,1.0,150,CNY,19,3,,,,15,Letlhakeng-Kang Road Section II 133 km (Dutlwe-Kang/Morwamosu)
Signed,2005,Botswana,SA,,,Government,CIDCA,ZIL,1.0,30,CNY,4,0,,,,,Unknown
Signed,2008,Botswana,SA,,,Government,CIDCA,ZIL,1.0,22,BWP,3,0,,10.0,10.0,20,Unknown
Completed,2009,Botswana,SA,2.0,AfrStateCom,Botswana Power Corporation (BPC) (SOE),ICBC,EBC,1.0,825,USD,825,,Libor + ?,,3.5,20,Morupule B Coal-Fired Power Station Expansion Project 600MW
Signed,2004,Botswana,SA,,,Government,Eximbank,EBC,1.0,200,CNY,24,3,,11.0,4.0,15,"Gaborone, Maun, Jwaneng, Lobatse and Francistown BHC Houses  - 725 houses  (EBC part)"
Completed,2000,Botswana,SA,,,Government,Eximbank,Loan,1.0,13,BWP,2,4,,12.0,4.0,16,Kasane BHC houses - 86 Houses
Completed,2001,Botswana,SA,,,Government,Eximbank,Loan,1.0,22,BWP,3,4,,8.0,4.0,12,Gaborone BHC houses - 217 Houses
Completed,2001,Botswana,SA,,,Government,Eximbank,Loan,1.0,16,BWP,2,4,,8.0,4.0,12,Francistown BHC Houses - 120 Houses
Completed,2003,Botswana,SA,,,Government,Eximbank,Loan,1.0,14,BWP,3,4,,8.0,4.0,12,Palapye BHC Houses - 150 Houses
Completed,2008,Lesotho,SA,,,Government,Eximbank,CL,1.0,30,USD,30,,,,5.0,20,Econet Telecom Lesotho National Network Project Phase I
Completed,2011,Lesotho,SA,,,Government,Eximbank,CL,1.0,30,USD,30,,,,,,Econet Telecom Lesotho National Network Project Phase II
Signed,2011,Lesotho,SA,,,Government,CIDCA,ZIL,1.0,50,CNY,8,0,,,,,Unknown
Implementation,2018,Lesotho,SA,,,Government,Eximbank,CL,1.0,1400,LSL,98,,,,5.0,20,Ha-Mpiti to SehlabaThebe Road 92km
Signed,2005,Namibia,SA,,,Government,CIDCA,ZIL,1.0,50,CNY,6,0,,,,,Small industrial/farming projects
Signed,2006,Namibia,SA,,,Government,CIDCA,ZIL,1.0,20,CNY,3,0,,,,,Unknown
Implementation,2007,Namibia,SA,,,Government,Eximbank,ZIL,1.0,301,NAD,44,2,,15.0,5.0,20,Custom Scanning Machines for Namibia Customs and Excise Department
Signed,2007,Namibia,SA,,,Government,CIDCA,ZIL,1.0,30,CNY,4,0,,,,,Green Scheme Programme and Aquaculture Project
Completed,2012,Namibia,SA,,,Government,Eximbank,CL,1.0,1142,NAD,135,2,,10.0,5.0,15,MR67 Omakange-Ruacana Road and DR3602 Omafo-Outapi Road Upgrade
Completed,2005,Namibia,SA,,,Government,Eximbank,CL,1.0,250,CNY,31,,,,,,17 Diesel Locomotives and 200 Train Cargos
Signed,2008,Namibia,SA,,,Government,Eximbank,CL,1.0,37,NAD,4,,,15.0,5.0,20,E-government software (government Record and Management upgrade)
Signed,2004,Namibia,SA,,,Government,CIDCA,ZIL,1.0,30,NAD,5,0,,,,,Unallocated
Completed,2012,Namibia,SA,2.0,AfrStateCom,Epangelo Mining Company (Epangelo) (SOE),Swakop Uranium (SU),SC,1.0,1882,NAD,223,,,,,,Purchase of 10% Stake in Husab Uranium Mine
Signed,2018,Namibia,SA,,AfrGov,Government,CIDCA,ZIL,1.0,120,NAD,8,,,,,,Gobabis and Grootfontein - 400 Houses
Completed,2009,Namibia,SA,,AfrGov,Government,Eximbank,CL,1.0,130,NAD,18,,,,,,Reinfontein National Youth Training Centre
Signed,2009,Namibia,SA,,,Government,CIDCA,ZIL,1.0,60,CNY,9,0,,,,,Okahandja Defense Academy Project
Implementation,2016,South Africa,SA,2.0,AfrStateCom,Transnet SOC Ltd (Transnet) (SOE),CDB,MFA-sub,1.0,6364,ZAR,464,,,,4.5,15,Transnet Locomotive Purchases - 2016 Disbursement
Implementation,2017,South Africa,SA,2.0,AfrStateCom,Transnet SOC Ltd (Transnet) (SOE),CDB,MFA-sub,1.0,1895,ZAR,153,,,,4.5,15,Transnet Locomotive Purchases - 2017 Disbursement
Implementation,2018,South Africa,SA,2.0,AfrStateCom,Transnet SOC Ltd (Transnet) (SOE),CDB,MFA-sub,1.0,2244,ZAR,156,,,,4.5,15,Transnet Locomotive Purchases - 2018 Disbursement
Implementation,2019,South Africa,SA,2.0,AfrStateCom,Transnet SOC Ltd (Transnet) (SOE),CDB,MFA-sub,1.0,4434,ZAR,317,,,,4.5,15,Transnet Locomotive Purchases - 2019 Disbursement
Completed,2016,South Africa,SA,2.0,AfrStateCom,Electricity Supply Commission (ESKOM) (SOE),CDB,Loan,1.0,500,USD,500,,,,,,"Infrastructure Construction, including Kusile and Medupi power stations"
Implementation,2016,South Africa,SA,2.0,AfrStateCom,Transnet SOC Ltd (Transnet) (SOE),BoC,CommL,1.0,3000,ZAR,219,,,,,,Transnet Club Loan - Bank of China 2016
Implementation,2018,South Africa,SA,2.0,AfrStateCom,Electricity Supply Commission (ESKOM) (SOE),CDB,MFA-sub,1.0,900,USD,900,,,,,,Medupi Coal Power Plant expansion (6X794=4800MW) Tranche A
Implementation,2019,South Africa,SA,2.0,AfrStateCom,Electricity Supply Commission (ESKOM) (SOE),CDB,MFA-sub,1.0,600,USD,600,,,,,,Medupi Coal Power Plant expansion (6X794=4800MW) Tranche B
Completed,2001,South Africa,SA,3.0,AfrStateBanks,South African Reserve Bank (SARB) (SOE),CCB,CommL,1.0,36,USD,36,,LIBOR/EURIBOR + 85bps,,,3,3-Year Syndicated Term Loan to support foreign currency position - CCB
Completed,2002,South Africa,SA,3.0,AfrStateBanks,South African Reserve Bank (SARB) (SOE),CCB,CommL,1.0,27,USD,27,,LIBOR/EURIBOR + 70bps,,,3,3-Year Syndicated Term Loan to support foreign currency position - CCB
Completed,2002,South Africa,SA,3.0,AfrStateBanks,South African Reserve Bank (SARB) (SOE),CCB,CommL,1.0,27,USD,27,,LIBOR/EURIBOR + 90bps,,,5,5-Year Syndicated Term Loan to support foreign currency position - CCB
